region_name,competition_year,id,name,short_desc,long_desc,eligibility,video_url,created_at,updated_at,sponsors,entries
New South Wales,2021,248,BETTER Public Spaces,"How do we help ensure everyone feels welcome and safe in public spaces (day and night) regardless of age, gender, ethnicity or identity?","### The Challenge:

This problem statement seeks to find solutions that support our **‘BETTER’** public spaces approach, specifically how we can ensure everyone feels welcome and safe in public spaces (day and night) regardless of age, gender, ethnicity or identity.   Not everyone in NSW can access and use public space in the same way. For example, research indicates that women are more likely to feel unwelcome and unsafe in public spaces than men, including when walking alone at night. 

As a part of the Places to Love program partnership between the Department and Penrith City Council, a Womens Night Walk was run in the Kingswood area. Seven key themes from the participants were identified to improve safety 1. Improve Lighting, 2. Create a seamless walking experience, 3. Make our open spaces a place to stay for the whole family, 4. Build on the sense of community, 5. Make our spaces visually attractive, 6. Green and breathable places, and 7. Address perceptions of safety. 

In 2020 the Department’s ‘Public spaces during COVID-19’ survey aimed to provide the NSW Government with insight into the changing uses of public spaces as a result of the COVID-19 pandemic. From 4,777 survey responses and online map comments, the following theme on safety in public spaces was a priority: Around 25% of comments were about safety in public spaces. The feedback suggests local communities have a good understanding of what their neighbourhoods need to be safe. This includes lower vehicle speed limits and other steps to make public spaces more inclusive and enjoyable for all.

### Background:

Quality green, open and public spaces are important to everyone. They are our free and publicly accessible parks, gardens and sports fields, walkable shady streets, libraries, museums and galleries, which form the heart of our communities. Our public spaces make life more welcoming and accessible. They delight and connect people. They support our health and well-being, environmental resilience and prosperous local economies. They’re at the heart of everyday life.

Public spaces are all places **publicly owned or of public use, accessible and enjoyable by all for free**. They include our **open spaces, public facilities (e.g. libraries, galleries, museums) and streets**. The quality of public space is a combination of its **physical form**, the **activities** that occur in the place and the **meaning** people associate with the place. 

The NSW Premier’s Priority Greener Public Spaces (the Priority) is to *increase the proportion of homes in urban areas within 10 minutes’ walk of quality green, open and public space by 10 percent by 2023*. To monitor the impact of the Priority we measure an increase in homes in urban areas that have improved access within 10 minutes’ walk (800m walking catchment) of a new or improved public space.  

To achieve the Priority, we are taking a “more, better, activated” approach, along with emphasising the resilience of public space as playing a key role in the “road to recovery” from recent disasters and the global COVID-19 pandemic. 

• MORE: identifying areas with lower access to public space, the Priority will target strategies that provide access to new quality public spaces in these areas
• **BETTER:** identifying areas with high access to public space, the Priority will target strategies that improve quality of public spaces in these areas 
• ACTIVATED: in all areas, the Priority will target strategies that increase activation 
• ROAD TO RECOVERY: Since 2019 we have also focused our work on the importance of public spaces in the resilience of communities to disasters such as bushfires, floods and the global COVID-19 pandemic. 

The Evaluation Tool for Public Space and Public Life, is the first resource in the new online Great Public Spaces Toolkit. It is a user-friendly resource that allows anyone to assess the quality of public spaces, its positive attributes, as well as areas for improvement. The NSW Public Spaces Charter is another key resource. The Charter, currently in draft form, can be used to guide planning, design, management and activation of public space. The Charter will be a resource for individuals, organisations and agencies responsible for public space.

### Additional Information:

On our webpage you will find more information about the Priority, along with current grant programs, case studies, ideas and opportunities for different types of public spaces - https://www.dpie.nsw.gov.au/premiers-priorities/great-public-spaces

**Department of Planning, Industry and Environment data:** 

Our advice would be to think broadly and creatively about how DPIE’s data can be used. For these problem statements we don’t always have data that will provide the answers, and we use other forms of information, including reports and surveys when hard data is not available.

•	[Public Spaces location GIS layers](https://www.planningportal.nsw.gov.au/spatialviewer/#/find-a-property/address) on the ePlanning [Spatial Viewer](https://www.planningportal.nsw.gov.au/spatialviewer/#/find-a-property/address) – this dataset helps to understand the provision of public space in a given area. Click “Public Spaces” layers on in the legend on the Viewer to show the location of known open spaces and public facilities across NSW.
•	[ePlanning Data Portal](https://www.planningportal.nsw.gov.au/opendata/) – a one stop shop for a whole range of open data relevant to public spaces, including NSW Urban Vegetation Cover; Principal Planning Layers such as land zoning; Natural Hazard layers; Green Infrastructure layers including: NSW Heat Vulnerability Index; NSW Urban Heat Island and more. These datasets can be viewed alongside the Public Spaces layers on the [Spatial Viewer](https://www.planningportal.nsw.gov.au/spatialviewer/#/find-a-property/address) within the Portal.
•	[Government Property Index](https://www.planningportal.nsw.gov.au/development-assessment/government-property-index?linkId=118681870) – is a new resource that means you can now search and view NSW Government-owned land and property online. The index is available spatially as a layer via the [Spatial Viewer](https://www.planningportal.nsw.gov.au/spatialviewer/#/find-a-property/address). Information on government owned Crown Land is also available as layers on the Viewer. 
•	[Public Spaces Streets as Shared Spaces Engagement Report](https://www.dpie.nsw.gov.au/__data/assets/pdf_file/0006/348027/Public-Spaces-Streets-as-Shared-Spaces-Engagement-Report.pdf) – includes results of survey aimed to provide the NSW Government with insight into the changing uses of public spaces as a result of the COVID-19 pandemic.
•	[Draft NSW Public Spaces Charter](https://www.dpie.nsw.gov.au/__data/assets/pdf_file/0007/347740/Draft-NSW-Public-Spaces-Charter.pdf) – developed to support the planning, design, management and activation of public spaces in NSW. It identifies ten principles for quality public space, developed through evidence-based research and discussions with public space experts and community members.
•	[Great Public Spaces Toolkit](https://www.dpie.nsw.gov.au/premiers-priorities/great-public-spaces/festival-of-place/great-public-spaces-toolkit) – including the [Evaluation Tool for Public Space and Public Life](https://www.dpie.nsw.gov.au/premiers-priorities/great-public-spaces/festival-of-place/great-public-spaces-toolkit#evaluation-tool-for-public-space-and-public-life) can be used by anyone wanting to better understand a public space’s strengths or areas for improvement. The [Great Public Spaces Guide](https://www.dpie.nsw.gov.au/premiers-priorities/great-public-spaces/festival-of-place/great-public-spaces-toolkit#great-public-spaces-guide), introduces the meaning of place and the elements that contribute to creating a great public facility, open space or street.

**Other Government agency datasets that may be of relevance:**

The other advice we would provide is that, more, better and activated public space is a cross cutting issue for the NSW Government. We have found that we often utilise other agency’s open data sources when we are looking to understand need and value of public space. 

•	Spatial Services [NSW Point of Interest (POI)](https://data.nsw.gov.au/data/dataset/nsw-points-of-interest-poi) web service provides the identification and location of a feature, service or activity that people may want to see, know about or visit.
•	Office of Local Government [Time Series](https://www.olg.nsw.gov.au/public/about-councils/comparative-council-information/your-council-report/) datasets, including data on Population per hectare of open space.
•	NSW Health [HealthStats](http://www.healthstats.nsw.gov.au/Indicatorgroup/TopicIndicatorGroups), including on topics such as Physical Activity Levels.
•	Transport for NSW [Open data portal](https://opendata.transport.nsw.gov.au/)
•	NSW Bureau of Crime Statistics and Research [Crime Statistics](https://www.bocsar.nsw.gov.au/Pages/bocsar_crime_stats/bocsar_crime_stats.aspx) data.
•	ABS 2016 [Census products](https://www.abs.gov.au/census/find-census-data/more-products), including Mesh block counts on population and dwellings, and Socio-Economic Indexes for Areas (SEIFA). 
•	National Recovery and Resilience Agency disaster-related [datasets](https://data.gov.au/data/organization/nbra), including for the March 2021 floods and 2019-20 bushfires.
•	Greater Sydney Commission [Greater Sydney Green Grid](https://www.greater.sydney/metropolis-of-three-cities/sustainability/city-its-landscape/green-grid-links-parks-open-spaces) – The Green Grid connects communities to the landscape. It is a long-term vision for a network of high quality green areas. 
•	Greater Sydney Commission documents including the [Greater Sydney Region Plan](https://www.greater.sydney/metropolis-of-three-cities), [Women’s Safety Charter](https://www.greater.sydney/thought-leadership/womens-safety-charter)
•	[Public Libraries in New South Wales Directory](https://www.sl.nsw.gov.au/public-library-services/about-public-library-services/find-public-library-nsw)
•	[Penrith City Councils Kingswood Live Work Play Grid](https://www.yoursaypenrith.com.au/project/liveworkplaykingswood) – Women’s Night walk including the summary of key findings report 

**Presentation at the New South Wales Connections Event**

•	[Conversation with Vanessa Gordon (Director of Place from the Department of Planning, Industry and Environment)](https://youtu.be/UpKmHWfcQNc?t=612)

**Image credit:** Burwood City Council library pop-up in the upgraded new laneway Unity Place, Department of Planning, Industry and Environment
","",https://www.youtube.com/embed/v5KvENR40kc,2021-08-19 01:08:20 +1000,2021-08-20 15:35:01 +1000,"[""NSW Department of Planning, Industry and Environment""]",14
Queensland,2021,267,Brisbane Olympics,"Queensland will host the 2032 Olympic Games in Brisbane.  Using Queensland open data, what can we do now to help the state prepare? ","Every four years, more than 11,000 athletes, from over 200 nations, compete in 33 different sports for medals and the title of the best in the world.  

The Brisbane games will be the 35th summer Olympics with the last Australian event held in Sydney in 2000.    

Preparing infrastructure, such as sporting venues, transportation and accommodation are all important.  

How can the visitor experience be improved?  

What can we do to ensure our athletes are prepared?  

### Additional Information:

**Additional links:**
• [data.qld.gov.au](https://www.data.qld.gov.au/)
• https://www.data.qld.gov.au/article/news-and-events/govhack-2021",Must use at least one dataset from data.qld.gov.au. ,"",2021-08-20 12:43:13 +1000,2021-08-20 12:46:57 +1000,"[""Queensland Government""]",7
South Australia,2021,269,Building Citizen’s Trust in this Digital World,"In order to access online services, citizens need to give their consent for their data to be used. How do you gain their trust that their data will be used appropriately? ","There has always been concerns around data governance and citizens having no visibility of what data is being collected from them, in which way and how it is being used. The terms and conditions might list these details, but it is not always the case that the citizens read (due to the length of it) or understand (due to the way it is written) it. This ties back to the trust that citizens have that the data is being used for bettering the systems and products.

In your solution, we would like you to consider who should have control of the citizen’s data – is it the citizens themselves or the Government or someone else?

How do we make what is collected visible to the citizen?

What technologies would you use, for example, blockchain or other technology?

### Additional Information:

**Job opportunity:**

• All finalists will have an opportunity to be interviewed for a job opportunity if interested.

**Additional links:**
• Here is a dataset that you may want to look at - [SA Government COVID SAfe Check-Ins dataset](https://hackerspace.govhack.org/data_sets/1081)

","","",2021-08-20 13:08:47 +1000,2021-08-20 13:08:47 +1000,"[""Pernix""]",7
Australia,2021,233,Create a solution to a customer need using the ABS Data API,"We are excited to provide innovators with machine to machine access to ABS Data and see what exciting customer solutions can be created. Here is a chance to draw in ABS Data and answer an important question through visualisation, mapping or even blending with other data sources. Create a solution to a customer need using data drawn from the ABS Data API.
","The ABS is improving the way we make our statistics available to inform Australians.  Since releasing the new ABS Website in September 2020, we have been focused on improving API access to data.  We are excited to provide innovators with machine to machine access to ABS Data and see what exciting customer solutions can be created. Here is a chance to draw in ABS Data and answer an important question through visualisation, mapping or even blending with other data sources.

**Video Explainer:** GovHack Digital Conference 2021: [Australia Bureau of Statistics - ABS Data API](https://www.youtube.com/watch?v=DZKWgOhRUVQ)","Teams are encouraged to use datasets from a variety of sources, but at least one must be drawn from the ABS Data API.",https://www.youtube.com/embed/DZKWgOhRUVQ,2021-08-18 23:29:43 +1000,2021-08-20 01:46:39 +1000,"[""Australian Bureau of Statistics""]",20
Queensland,2021,254,Deadly choices for Moreton Bay (QLD),"How can we support the development of social and cultural outcomes across the Moreton Bay Region?
","Using Open Data from a variety of sources, help us create social and cultural opportunities for our residents, including our First Nations people. Ideas and examples could include ready supply of fresh fruit and vegetables for socio-economic disadvantaged groups, through to art trails through to professional development and skills building.  All ideas welcome, and remember to focus on our region!

This is one of three Moreton Bay specific challenges put together by a consortium of business, education and government organisations, all passionate about our local region.  We will have a group of USC Moreton Bay students participating on campus at Petrie Mill alongside local innovators, and we encourage you to join with them in putting a spotlight on our region.

### Additional Information:

**Additional links:**
• https://www.moretonbay.qld.gov.au/Services/Business-Investment/REDS 
• https://datahub.moretonbay.qld.gov.au","Open to everyone, preference will be given to those providing solutions using at least one local Moreton Bay data set.","",2021-08-19 14:03:51 +1000,2021-08-20 01:02:44 +1000,"[""Moreton Bay Regional Council""]",5
Queensland,2021,265,Digital Economy ,What can we learn from open data that will help Queenslanders grow the digital economy during the COVID-19 recovery?,"Many Queenslanders, and citizens across the world, have been forced into a digital transformation while navigating the COVID-19 pandemic.  

Online services, virtual environments, data sharing and analysis have all developed significantly in recent times.  

What can we learn from this transition to uplift digital capability and improve digital services?

### Additional Information:

**Additional links:**

• [data.qld.gov.au](https://www.data.qld.gov.au/)
• https://www.data.qld.gov.au/article/news-and-events/govhack-2021
","Must use at least one dataset from data.qld.gov.au.  
","",2021-08-20 12:26:30 +1000,2021-08-20 12:48:36 +1000,"[""Queensland Government""]",3
New Zealand,2021,262,Digital Future – New Zealand,"How can New Zealand lead its effort to build Digital Skills, Education and Employment?
","The global health crisis has accelerated digitalisation by at least a decade. For New Zealand to be a world leading digital economy, there’s a need to build digital technology skills, develop a tech start-up ecosystem that will create more employment opportunities in the economy. 

We want you to re-imagine learning and skills programs that will lead to a thriving digital start-up ecosystem in New Zealand. While technology is changing our lives for the better, it’s also augmenting how we work, replacing repetitive tasks performed by humans and allowing people the opportunity to work in areas that leverage creative and cognitive skills. 

According to research from NZTech, the global health crisis has pushed New Zealand’s digital skills shortage to crisis point. The organisation’s digital skill survey found that the pandemic has caused a severe skills shortage of digital skills in New Zealand and there could be as many as 10,000 open roles that companies are struggling to fill. 

For New Zealand to be a world leading digital economy it’s crucial for it to re-imagine its approach to education, learning and employment that will accelerate digital skills. An important area to consider while working on this challenge is the need to build a culture that encourages New Zealanders to embrace digital skills. 

•	How can we enable workers today and tomorrow possess the skills to succeed in our future? 
•	How can we prepare future students for the jobs of tomorrow? 
•	How can we identify and encourage the next generation of technologists who may need help to realise those future opportunities? 

Everything from business operations to consumer choices to employment opportunities have changed due to the global health crisis. The impact of digital skills shortage in our labour market is significantly impacting our country’s economic output. How can we build net-new talent and build a sustainable ecosystem of job creation via New Zealand digital start-up and enable talent that can support such an ecosystem.

### Additional Information:

**Additional links:**

IT Brief New Zealand (12 August 2021): [NZ’s digital skills shortage reaches crisis point: How to attract and retain talent during tough times](https://itbrief.co.nz/story/nz-s-digital-skills-shortage-reaches-crisis-point-how-to-attract-and-retain-talent-during-tough-times)

NZ Tech: [New Zealand facing a digital skills crisis](https://nztech.org.nz/2021/07/05/new-zealand-facing-a-digital-skills-crisis/)

**Image credit:** Infosys",Must use at least one open dataset.,"",2021-08-20 11:17:37 +1000,2021-08-20 11:19:29 +1000,"[""Infosys""]",2
New South Wales,2021,251,Emerging population trends and post-pandemic planning,"What is the impact of COVID-19 on reshaping population growth and distribution across NSW?
","Much established population data is backward looking, and only available well after the events that may alter it. Whilst, under ‘normal’ conditions, there is inertia in much population change; the last two years have demonstrated that sizable shocks can occur.

What does a shock, such as the COVID-19 pandemic mean for projecting future population change. Can pre-existing trends be expected to reoccur or can ‘early-warning’ signals of emerging trends be identified while they are still developing?

**More information:**

We know the 2021 Census is going to be a snapshot of a very turbulent time and alternative data is needed to better identify contemporary population change (both growth and decline). 

The modelling that the population team does is around where people live and the communities they live in. Household sizes are changing all the time, but how will a shock such as the COVID-19 pandemic influence household size. For instance, has the pandemic resulted in more young people who have come from regional areas to metropolitan areas for study or work, move back home for a cheaper and safer lifestyle. If this is occurring, what impact does this have on household sizes, are they getting bigger? What does this mean for infrastructure and service delivery in regional communities?

Considering the uncertainty around the impacts of the pandemic and what this means for the future, how can we automate and produce a synthetic resource to be able to track better data? Has COVID-19 reshaped the population in NSW? 

How do we show the impact it has on communities within NSW? 

How can NSW Government help with the change within local communities, especially regional and rural communities?
","","",2021-08-19 01:41:36 +1000,2021-08-20 00:51:37 +1000,"[""NSW Department of Planning, Industry and Environment""]",6
New Zealand,2021,276,Engaging with SmartView-Go: Encouraging interaction between citizens and their city,"The city council wants to encourage higher interaction between citizens of how people feel about the city, share education on their constraints on resources, and provide a platform to reward citizen action.
","The council has limited resources and wants to spend money and time on larger projects, so how do we reward a citizen taking the initiative on reporting and solving smaller city issues?

The goal is to allow the Christchurch City Council to engage with the public by using an outdoor smartphone app (for example think about how games such as Pokemon-Go, Ingress Prime or others encourage people to go outside).

The council wants to encourage “Active Citizenship”, encouraging the public to identify and report any issues, as well as encouraging citizens to take action on them. The council has limited resources and wants to spend money and time on larger projects, so how do we reward a citizen taking the initiative on smaller reported city issues? For example:

• Cleaning up graffiti
• Removing doggy doo on the footpath
• Picking up rubbish in parks

The council might want to communicate to the public about projects they are undertaking and ask for the public opinion and satisfaction. For example:

• ""You are using a new bike path, how do you like it?""
• ""You pass by a smart rubbish bin which is part of the smart city development and read about the project.""
• ""This tree is an apple tree, come back around May to collect apples.""

This challenge is about creativity and developing the engagement of the council and citizens via a fun app so description and example above are only for inspiration. You can make a difference! 

Build our your ideas for a smartphone app that encourages interaction between citizens and their city and encourages citizen action.

### Additional Information: 

Below are examples of how you might wish to approach this challenge. Please use this as an example only and not as guidance.

**For example:**

ONE - Provide an application that will allow a citizen to report a new issue

a. Added feature to look for reported issues around me, take assignment, allow a photo to be capture before and after, and submit the resolution
b. Added feature to show a citizen their current points level and list of their achievements
c. Allow a feature to share these achievements on social media
d. Display what they can use the points for: rewards list

TWO - Add SnapSendSolve data for Graffiti information issues within the search function

THREE - Provide a feature to read and add a comment on a council area of interest

a. Smart rubbish location, Bike paths, CCC project location, Fruit trees, Drinking fountain, Street Art
","One or more team members must be able to attend and present at the Te Pae Technology Expo in Oct 2021(at their own expense).
","",2021-08-20 15:04:16 +1000,2021-08-21 11:13:27 +1000,"[""Smart Christchurch "", ""UC Business School Te Kura Umanga"", ""Trimble""]",2
